[
  {
    "id": "",
    "type": "考试保过真题",
    "name": "考试“保过/内部真题”诈骗",
    "risk_level": "high",
    "keywords": ["保过", "内部真题", "包过", "押题", "答案出售", "预付定金", "考试群", "改分", "四六级真题", "考研真题"],
    "patterns": [
      "(保过|包过|内部真题|押题).*(定金|预付|付款|转账)",
      "(四六级|考研|考试).*(真题|答案).*(出售|购买|提供)"
    ],
    "script_examples": [
      "内部渠道拿到本次四六级真题答案，先付定金锁定",
      "名师押题保过，不过全额退款",
      "加群领取考研内部真题，名额有限速来"
    ],
    "steps": [
      "考前在社群/短视频发布“保过、内部真题”广告引流备考学生",
      "以预付定金或全款“锁定名额”诱导付款",
      "收款后拉黑跑路，或以“激活费/保证金”连环收费"
    ],
    "why_scam": [
      "国家反诈八个凡是·第一条：凡是先交钱才能“保过/拿真题”的都是诈骗",
      "国家考试真题启用前属国家秘密，任何售卖“真题/答案/包过”均为诈骗且违法",
      "参与考试作弊本身违法，受害者往往不敢报案、维权困难"
    ],
    "advice": [
      "不信任何“保过/真题”承诺",
      "考试信息只认官方考试院渠道",
      "已付款立即拨打96110并留存记录"
    ],
    "emergency": ["96110", "南大保卫处 81686110"],
    "source": "教育部教育考试院公开提示 + 央视新闻反诈报道"
  }
]
